{
  "name": "ensemble-e2e-testing",
  "version": "4.0.0",
  "description": "End-to-end testing with Playwright integration",
  "author": {
    "name": "Fortium Partners",
    "email": "support@fortiumpartners.com",
    "url": "https://github.com/FortiumPartners"
  },
  "repository": "https://github.com/FortiumPartners/ensemble",
  "license": "MIT",
  "keywords": [
    "e2e",
    "playwright",
    "testing",
    "ensemble"
  ],
  "agents": "./agents",
  "commands": "./commands",
  "skills": "./skills",
  "dependencies": [
    "ensemble-core@4.0.0"
  ]
}