{
  "name": "ensemble-rspec",
  "version": "4.0.0",
  "description": "RSpec testing framework integration",
  "author": {
    "name": "Fortium Partners",
    "email": "support@fortiumpartners.com",
    "url": "https://github.com/FortiumPartners"
  },
  "repository": "https://github.com/FortiumPartners/ensemble",
  "license": "MIT",
  "keywords": [
    "rspec",
    "testing",
    "ruby",
    "ensemble"
  ],
  "commands": "./commands",
  "skills": "./skills",
  "dependencies": [
    "ensemble-quality@4.0.0"
  ]
}
