{
  "name": "ensemble-blazor",
  "version": "4.0.0",
  "description": "Blazor framework skills for .NET applications",
  "author": {
    "name": "Fortium Partners",
    "email": "support@fortiumpartners.com",
    "url": "https://github.com/FortiumPartners"
  },
  "repository": "https://github.com/FortiumPartners/ensemble",
  "license": "MIT",
  "keywords": [
    "blazor",
    "dotnet",
    "frontend",
    "ensemble"
  ],
  "commands": "./commands",
  "skills": "./skills",
  "dependencies": [
    "ensemble-development@4.0.0"
  ]
}
