{
  "name": "ensemble-quality",
  "version": "4.0.0",
  "description": "Quality assurance, code review, and DoD enforcement",
  "author": {
    "name": "Fortium Partners",
    "email": "support@fortiumpartners.com",
    "url": "https://github.com/FortiumPartners"
  },
  "repository": "https://github.com/FortiumPartners/ensemble",
  "license": "MIT",
  "keywords": [
    "quality",
    "review",
    "testing",
    "ensemble"
  ],
  "commands": "./commands",
  "skills": "./skills",
  "dependencies": [
    "ensemble-core@4.0.0"
  ]
}
