{
  "name": "ensemble-jest",
  "version": "4.0.0",
  "description": "Jest testing framework integration",
  "author": {
    "name": "Fortium Partners",
    "email": "support@fortiumpartners.com",
    "url": "https://github.com/FortiumPartners"
  },
  "repository": "https://github.com/FortiumPartners/ensemble",
  "license": "MIT",
  "keywords": [
    "jest",
    "testing",
    "javascript",
    "ensemble"
  ],
  "commands": "./commands",
  "skills": "./skills",
  "dependencies": [
    "ensemble-quality@4.0.0"
  ]
}
