{
  "name": "ensemble-git",
  "version": "4.0.0",
  "description": "Git workflow automation and conventional commits",
  "author": {
    "name": "Fortium Partners",
    "email": "support@fortiumpartners.com",
    "url": "https://github.com/FortiumPartners"
  },
  "repository": "https://github.com/FortiumPartners/ensemble",
  "license": "MIT",
  "keywords": [
    "git",
    "workflow",
    "commits",
    "ensemble"
  ],
  "agents": "./agents",
  "commands": "./commands",
  "skills": "./skills",
  "dependencies": [
    "ensemble-core@4.0.0"
  ]
}