{
  "name": "ensemble-development",
  "version": "4.0.0",
  "description": "Development agents for frontend/backend implementation",
  "author": {
    "name": "Fortium Partners",
    "email": "support@fortiumpartners.com",
    "url": "https://github.com/FortiumPartners"
  },
  "repository": "https://github.com/FortiumPartners/ensemble",
  "license": "MIT",
  "keywords": [
    "development",
    "implementation",
    "coding",
    "ensemble"
  ],
  "commands": "./commands",
  "skills": "./skills",
  "dependencies": [
    "ensemble-core@4.0.0"
  ]
}
