{
  "name": "ensemble-task-progress-pane",
  "version": "5.0.0",
  "description": "Real-time task progress visualization for Claude Code TodoWrite operations",
  "author": {
    "name": "Fortium Partners",
    "email": "support@fortiumpartners.com"
  },
  "license": "MIT",
  "repository": "https://github.com/FortiumPartners/ensemble",
  "hooks": "./hooks",
  "commands": "./commands"
}
