{
  "name": "ensemble-exunit",
  "version": "4.0.0",
  "description": "ExUnit testing framework integration for Elixir",
  "author": {
    "name": "Fortium Partners",
    "email": "support@fortiumpartners.com",
    "url": "https://github.com/FortiumPartners"
  },
  "repository": "https://github.com/FortiumPartners/ensemble",
  "license": "MIT",
  "keywords": [
    "exunit",
    "testing",
    "elixir",
    "ensemble"
  ],
  "agents": "./agents",
  "commands": "./commands",
  "skills": "./skills",
  "dependencies": [
    "ensemble-quality@4.0.0"
  ]
}