{
  "name": "ensemble-pane-viewer",
  "version": "0.1.0",
  "description": "Real-time subagent monitoring in terminal panes",
  "author": {
    "name": "Fortium Partners",
    "email": "support@fortiumpartners.com",
    "url": "https://github.com/FortiumPartners"
  },
  "repository": "https://github.com/FortiumPartners/ensemble",
  "license": "MIT",
  "keywords": [
    "monitoring",
    "terminal",
    "panes",
    "ensemble"
  ],
  "commands": "./commands",
  "skills": "./skills"
}
