{
  "name": "ensemble-infrastructure",
  "version": "4.0.0",
  "description": "Infrastructure management for AWS, Kubernetes, Docker, Helm, Fly.io",
  "author": {
    "name": "Fortium Partners",
    "email": "support@fortiumpartners.com",
    "url": "https://github.com/FortiumPartners"
  },
  "repository": "https://github.com/FortiumPartners/ensemble",
  "license": "MIT",
  "keywords": [
    "infrastructure",
    "devops",
    "kubernetes",
    "aws",
    "ensemble"
  ],
  "commands": "./commands",
  "skills": "./skills",
  "dependencies": [
    "ensemble-core@4.0.0"
  ]
}
