{
  "name": "ensemble-xunit",
  "version": "4.0.0",
  "description": "xUnit testing framework integration for .NET",
  "author": {
    "name": "Fortium Partners",
    "email": "support@fortiumpartners.com",
    "url": "https://github.com/FortiumPartners"
  },
  "repository": "https://github.com/FortiumPartners/ensemble",
  "license": "MIT",
  "keywords": [
    "xunit",
    "testing",
    "dotnet",
    "ensemble"
  ],
  "commands": "./commands",
  "skills": "./skills",
  "dependencies": [
    "ensemble-quality@4.0.0"
  ]
}
