{
  "name": "ensemble-metrics",
  "version": "4.0.0",
  "description": "Productivity metrics and analytics dashboard",
  "author": {
    "name": "Fortium Partners",
    "email": "support@fortiumpartners.com",
    "url": "https://github.com/FortiumPartners"
  },
  "repository": "https://github.com/FortiumPartners/ensemble",
  "license": "MIT",
  "keywords": [
    "metrics",
    "analytics",
    "dashboard",
    "ensemble"
  ],
  "agents": "./agents",
  "commands": "./commands",
  "skills": "./skills",
  "dependencies": [
    "ensemble-core@4.0.0"
  ]
}