{
  "name": "ensemble-core",
  "version": "4.0.0",
  "description": "Core orchestration and utilities for ensemble ecosystem",
  "author": {
    "name": "Fortium Partners",
    "email": "support@fortiumpartners.com",
    "url": "https://github.com/FortiumPartners"
  },
  "repository": "https://github.com/FortiumPartners/ensemble",
  "license": "MIT",
  "keywords": [
    "orchestration",
    "agents",
    "core",
    "ensemble"
  ],
  "agents": "./agents",
  "commands": "./commands",
  "skills": "./skills"
}