{
  "name": "ensemble-phoenix",
  "version": "4.0.0",
  "description": "Phoenix LiveView framework skills",
  "author": {
    "name": "Fortium Partners",
    "email": "support@fortiumpartners.com",
    "url": "https://github.com/FortiumPartners"
  },
  "repository": "https://github.com/FortiumPartners/ensemble",
  "license": "MIT",
  "keywords": [
    "phoenix",
    "elixir",
    "liveview",
    "ensemble"
  ],
  "commands": "./commands",
  "skills": "./skills",
  "dependencies": [
    "ensemble-development@4.0.0"
  ]
}
