{
  "name": "ensemble-agent-progress-pane",
  "version": "5.1.0",
  "description": "Real-time agent progress visualization in terminal panes",
  "author": {
    "name": "Fortium Partners",
    "email": "support@fortiumpartners.com",
    "url": "https://github.com/FortiumPartners"
  },
  "repository": "https://github.com/FortiumPartners/ensemble",
  "license": "MIT",
  "keywords": [
    "agent",
    "progress",
    "monitoring",
    "terminal",
    "panes",
    "ensemble"
  ],
  "hooks": "./hooks/hooks.json",
  "commands": "./commands",
  "skills": "./skills"
}
